{
  "schema_version": "1.0",
  "registry_purpose": "Canonical mapping and provenance record for Kinder Signs reference material, technical evidence, demo media and internal visual outputs.",
  "resource_root": "../resources",
  "canonical_sign_ids": [
    "more",
    "help",
    "eat",
    "sleep",
    "milk",
    "water"
  ],
  "asset_classes": [
    "THIRD_PARTY_REFERENCE",
    "FOUNDER_PROVIDED_REFERENCE",
    "TECHNICAL_EVIDENCE",
    "PREGENERATED_DEMO_OUTPUT",
    "KINDERFLOW_DERIVED_ASSET",
    "KINDERFLOW_RUNTIME_ASSET"
  ],
  "assets": {
    "canonical_sign_content": {
      "path": "prototype/data/signs.json",
      "exists": true,
      "file_type": "application/json",
      "byte_size": 15176,
      "sha256": "1cdbb3d551076604ac01ea6429e063122a7dff97e7c54a3b75a71e2236adf3f1",
      "sign_mapping": [
        "more",
        "help",
        "eat",
        "sleep",
        "milk",
        "water"
      ],
      "workflow_role": "Existing internal bilingual sign and product-state source",
      "asset_class": "KINDERFLOW_RUNTIME_ASSET",
      "licence_or_provenance_status": "KINDERFLOW_INTERNAL",
      "redistribution_allowed": true,
      "demo_display_allowed": true,
      "printable_allowed": false,
      "known_limitation": "Contains additional non-canonical prototype signs and is not linguistic certification."
    },
    "visual_sign_packages": {
      "path": "prototype/data/visual_sign_packages.json",
      "exists": true,
      "file_type": "application/json",
      "byte_size": 40981,
      "sha256": "1138082a53af304f5a1b55baa21484f6cbd696d1212f2ac3cb531f10c4f8350b",
      "sign_mapping": [
        "more",
        "help",
        "eat",
        "sleep",
        "milk",
        "water"
      ],
      "workflow_role": "Existing internal visual grounding package",
      "asset_class": "KINDERFLOW_RUNTIME_ASSET",
      "licence_or_provenance_status": "KINDERFLOW_INTERNAL",
      "redistribution_allowed": true,
      "demo_display_allowed": true,
      "printable_allowed": false,
      "known_limitation": "All six canonical signs have controlled visual options; every option still requires human review."
    },
    "open_peeps_bust_base": {
      "path": "../resources/Flat Assets/Separate Atoms/a person/bust.svg",
      "exists": true,
      "file_type": "image/svg+xml",
      "byte_size": 26663,
      "sha256": "b631d9ab4a7bb7d0f632ffb42185825d4cf208853eb2c07338a15cc4999601df",
      "sign_mapping": [
        "more",
        "help",
        "eat",
        "sleep",
        "milk",
        "water"
      ],
      "workflow_role": "Open Peeps base character identity reference",
      "asset_class": "THIRD_PARTY_REFERENCE",
      "licence_or_provenance_status": "FOUNDER_VERIFIED_CC0_OFFICIAL_SOURCE",
      "redistribution_allowed": true,
      "demo_display_allowed": true,
      "printable_allowed": false,
      "known_limitation": "Character identity only; it is not evidence for sign mechanics."
    },
    "open_peeps_arm_reference": {
      "path": "../resources/Flat Assets/Templates/Bust/peep-4.svg",
      "exists": true,
      "file_type": "image/svg+xml",
      "byte_size": 44256,
      "sha256": "2e354cb71804158d4b5fa9ab8a6721c5cff1b74461990e911e1b2a2cf2e79ef0",
      "sign_mapping": [
        "more",
        "help",
        "eat",
        "sleep",
        "milk",
        "water"
      ],
      "workflow_role": "Complementary Open Peeps arm and hand style reference",
      "asset_class": "THIRD_PARTY_REFERENCE",
      "licence_or_provenance_status": "FOUNDER_VERIFIED_CC0_OFFICIAL_SOURCE",
      "redistribution_allowed": true,
      "demo_display_allowed": true,
      "printable_allowed": false,
      "known_limitation": "Supplementary visual reference only; it is not a final character pose or sign source."
    },
    "open_peeps_pointing_finger_reference": {
      "path": "../resources/Flat Assets/Separate Atoms/pose/standing/pointing_finger-1.svg",
      "exists": true,
      "file_type": "image/svg+xml",
      "byte_size": 25007,
      "sha256": "b5fc22a9f2f5b2229b789e49587c6998564fa7b524f4b1107e3c25b640c12fd0",
      "sign_mapping": [
        "more",
        "help",
        "eat",
        "sleep",
        "milk",
        "water"
      ],
      "workflow_role": "Expected exact Open Peeps hand-style reference",
      "asset_class": "THIRD_PARTY_REFERENCE",
      "licence_or_provenance_status": "FOUNDER_VERIFIED_CC0_OFFICIAL_SOURCE",
      "redistribution_allowed": true,
      "demo_display_allowed": true,
      "printable_allowed": false,
      "known_limitation": "Hand-style reference only; it is not a final pose or sign-mechanics source."
    },
    "functional_more": {
      "path": "../resources/ilustraciones/more.jpg",
      "exists": true,
      "file_type": "image/jpeg",
      "byte_size": 108814,
      "sha256": "b11d125a41b4ee5ea180361c7dc0f359d72ae366517128ae8a25664a3083408c",
      "sign_mapping": [
        "more"
      ],
      "workflow_role": "Functional sign mechanics and pose reference",
      "asset_class": "FOUNDER_PROVIDED_REFERENCE",
      "licence_or_provenance_status": "FOUNDER_PROVIDED_RIGHTS_CONFIRMATION_NEEDED",
      "redistribution_allowed": null,
      "demo_display_allowed": null,
      "printable_allowed": false,
      "known_limitation": "Defines mechanics only and must not define KinderFlow character identity."
    },
    "functional_help": {
      "path": "../resources/ilustraciones/help.jpg",
      "exists": true,
      "file_type": "image/jpeg",
      "byte_size": 42007,
      "sha256": "079370a2bd6e301c64d29cc16a99ca09ec15af304330e3a77a30b7d351f4ee28",
      "sign_mapping": [
        "help"
      ],
      "workflow_role": "Functional sign mechanics and pose reference",
      "asset_class": "FOUNDER_PROVIDED_REFERENCE",
      "licence_or_provenance_status": "FOUNDER_PROVIDED_RIGHTS_CONFIRMATION_NEEDED",
      "redistribution_allowed": null,
      "demo_display_allowed": null,
      "printable_allowed": false,
      "known_limitation": "Defines mechanics only and must not define KinderFlow character identity."
    },
    "functional_eat": {
      "path": "../resources/ilustraciones/eat.jpg",
      "exists": true,
      "file_type": "image/jpeg",
      "byte_size": 146232,
      "sha256": "9dac1ea686fc24a33b2ab3c088191cdc26ac1b8bed52e0e17d3f37b0b979a120",
      "sign_mapping": [
        "eat"
      ],
      "workflow_role": "Functional sign mechanics and pose reference",
      "asset_class": "FOUNDER_PROVIDED_REFERENCE",
      "licence_or_provenance_status": "FOUNDER_PROVIDED_RIGHTS_CONFIRMATION_NEEDED",
      "redistribution_allowed": null,
      "demo_display_allowed": null,
      "printable_allowed": false,
      "known_limitation": "Defines mechanics only and must not define KinderFlow character identity."
    },
    "functional_sleep": {
      "path": "../resources/ilustraciones/sleep.jpg",
      "exists": true,
      "file_type": "image/jpeg",
      "byte_size": 28910,
      "sha256": "7fbdd8145fa0524d86c2d9c6c1bce57e148c24c01f2e501486f1c592248ce6bc",
      "sign_mapping": [
        "sleep"
      ],
      "workflow_role": "Functional sign mechanics and pose reference",
      "asset_class": "FOUNDER_PROVIDED_REFERENCE",
      "licence_or_provenance_status": "FOUNDER_PROVIDED_RIGHTS_CONFIRMATION_NEEDED",
      "redistribution_allowed": null,
      "demo_display_allowed": null,
      "printable_allowed": false,
      "known_limitation": "Defines mechanics only and must not define KinderFlow character identity."
    },
    "functional_milk": {
      "path": "../resources/ilustraciones/milk.jpg",
      "exists": true,
      "file_type": "image/jpeg",
      "byte_size": 28482,
      "sha256": "e6e815f0f03fb83a99ecba03d8f4d3fb920ac1b85174b3739a7152817a9d9801",
      "sign_mapping": [
        "milk"
      ],
      "workflow_role": "Functional sign mechanics and pose reference",
      "asset_class": "FOUNDER_PROVIDED_REFERENCE",
      "licence_or_provenance_status": "FOUNDER_PROVIDED_RIGHTS_CONFIRMATION_NEEDED",
      "redistribution_allowed": null,
      "demo_display_allowed": null,
      "printable_allowed": false,
      "known_limitation": "Defines mechanics only and must not define KinderFlow character identity."
    },
    "functional_hand_sheet_jpg": {
      "path": "../resources/ilustraciones/illustraciones_signos.jpg",
      "exists": true,
      "file_type": "image/jpeg",
      "byte_size": 1378160,
      "sha256": "315bdee7269e14711ca0290283a4afdc34569026914d3db900af8a38516351da",
      "sign_mapping": [
        "more",
        "help",
        "eat",
        "sleep",
        "milk",
        "water"
      ],
      "workflow_role": "Supplementary raster hand and sign reference sheet",
      "asset_class": "FOUNDER_PROVIDED_REFERENCE",
      "licence_or_provenance_status": "FOUNDER_PROVIDED_RIGHTS_CONFIRMATION_NEEDED",
      "redistribution_allowed": null,
      "demo_display_allowed": null,
      "printable_allowed": false,
      "known_limitation": "Supplementary mechanics reference only; not a final KinderFlow asset."
    },
    "functional_hand_sheet_eps": {
      "path": "../resources/ilustraciones/vectores_illustraciones.eps",
      "exists": true,
      "file_type": "application/postscript",
      "byte_size": 3475398,
      "sha256": "617281bfbdcb342183cd4eb2de55297304cebdbc428127e49a10371314cff01b",
      "sign_mapping": [
        "more",
        "help",
        "eat",
        "sleep",
        "milk",
        "water"
      ],
      "workflow_role": "Supplementary vector illustration source sheet",
      "asset_class": "FOUNDER_PROVIDED_REFERENCE",
      "licence_or_provenance_status": "FOUNDER_PROVIDED_RIGHTS_CONFIRMATION_NEEDED",
      "redistribution_allowed": null,
      "demo_display_allowed": false,
      "printable_allowed": false,
      "known_limitation": "Reference/editing source only; provenance and redistribution rights are not documented."
    },
    "input_more": {
      "path": "../resources/video_input/more.mp4",